{
  "$schema": "http://json-schema.org/draft-04/schema#",
  "type": "object",
  "properties": {
    "format": {
      "type": "string"
    },
    "output": {
      "type": "string"
    },
    "owner": {
      "type": "integer"
    },
    "prefix": {
      "type": "string"
    },
    "uppercase": {
      "type": "boolean"
    },
    "secrets": {
      "type": "array",
      "prefixItems": [
        {
          "type": "string"
        },
        {
          "type": "object",
          "additionalProperties": false,
          "patternProperties": {
            "^*$": {
              "type": "object",
              "additionalProperties": false,
              "properties": {
                "owner": {
                  "type": "integer"
                },
                "format": {
                  "type": "string",
                  "enum": [
                    "json",
                    "env",
                    "secret"
                  ]
                },
                "prefix": {
                  "type": "string"
                },
                "saveAsFile": {
                  "type": "boolean"
                },
                "required": [
                  "owner",
                  "prefix"
                ]
              }
            }
          }
        }
      ]
    }
  },
  "required": [
    "output",
    "secrets"
  ]
}